slug,name,category,description,author,created,last_modified,website,privileges,free,verification,supported_os,capabilities,installation_paths,pe_original_names,pe_filenames,vulnerabilities,references,source_file
neturo,Neturo,RMM,Neturo is a remote monitoring and management (RMM) tool. More information will be added as it becomes available.,,2024-08-02,2024-08-02,,,,,Windows,,neturo*.exe | ntrntservice.exe | neturo.exe,,,,http://www.iconpos.com/pos/home/iconpos/bbs.php?id=file&q=view&uid=2,neturo.yaml
netviewer,Netviewer,RMM,Netviewer is a remote monitoring and management (RMM) tool. More information will be added as it becomes available.,,2024-08-02,2024-08-02,,,,,,,netviewer*.exe | netviewer.exe,,,,,netviewer.yaml
netviewer_(gotomeet),Netviewer (GoToMeet),RMM,Netviewer (GoToMeet) is a remote monitoring and management (RMM) tool. More information will be added as it becomes available.,,2024-08-02,2024-08-02,https://www.goto.com/meeting/join,,,,,,nvClient.exe | netviewer.exe,,,,https://www.enviolet.com/en/service/online-consultant.html,netviewer_(gotomeet).yaml
ngrok,ngrok,RAT,ngrok is a remote monitoring and management (RMM) tool. More information will be added as it becomes available.,Jose Hernandez,2024-07-19,2024-07-19,https://ngrok.com/,,,,,,ngrok.exe | C:\*\ngrok.zip | *\ngrok*,,,,https://ngrok.com/docs/guides/running-behind-firewalls/,ngrok.yaml
ninjaone_(formerly_ninjarmm),NinjaOne (formerly NinjaRMM),RMM,NinjaOne (formerly NinjaRMM) is a remote monitoring and management (RMM) tool. More information will be added as it becomes available.,,2024-08-02,2024-08-02,https://www.ninjaone.com/rmm/,,,,,,*ProgramData\NinjaRMMAgent\*,,,,,ninjaone_(formerly_ninjarmm).yaml
ninjarmm,NinjaRMM,RMM,NinjaRMM is a remote monitoring and management (RMM) tool. More information will be added as it becomes available.,,2024-08-02,2026-01-27,https://www.ninjaone.com/rmm/,,,,,,NinjaRMMAgent.exe | NinjaRMMAgentPatcher.exe | ninjarmm-cli.exe,,,,https://www.ninjaone.com/faq/,ninjarmm.yaml
nomachine,NoMachine,RAT,NoMachine is a remote monitoring and management (RMM) tool. More information will be added as it becomes available.,,2024-08-02,2024-08-02,https://www.nomachine.com/,,,,,,nomachine*.exe | nxservice*.ese | nxd.exe,,,,https://kb.nomachine.com/AR04S01122,nomachine.yaml
nordlocker,NordLocker,RAT,NordLocker is a remote monitoring and management (RMM) tool. More information will be added as it becomes available.,,2024-08-02,2024-08-02,https://nordlocker.com/,,,,,,,,,,,nordlocker.yaml
noteon-desktop_sharing,NoteOn-desktop sharing,RAT,NoteOn-desktop sharing is a remote monitoring and management (RMM) tool. More information will be added as it becomes available.,,2024-08-02,2024-08-02,,,,,,,nateon*.exe | nateon.exe | nateonmain.exe,,,,,noteon-desktop_sharing.yaml
ntr_remote,NTR Remote,RMM,NTR Remote is a remote monitoring and management (RMM) tool. More information will be added as it becomes available.,,2024-08-02,2024-08-02,,,,,Windows,,NTRsupportPro_EN.exe,,,,,ntr_remote.yaml
nvda,NVDA (Non-Visual Desktop Access),RMM,"NVDA (Non-Visual Desktop Access) is a free, open-source screen reader that allows blind and vision impaired people to access and interact with the Windows operating system and many third party applications. Recent versions include a ""Remote Access"" feature that enables remote support and assistance capabilities.",Michael Haag,2026-01-15,2026-01-15,https://www.nvaccess.org/,User,True,Open Source,Windows,Screen Reading | Remote Access | Remote Support | Accessibility Features,C:\Program Files (x86)\NVDA\nvda.exe | C:\Program Files\NVDA\nvda.exe | C:\Users\*\AppData\Roaming\nvda\* | C:\Users\*\AppData\Local\Temp\nvda_*\* | nvda.exe | nvda_service.exe | nvda_*.exe,,nvda.exe | nvda_service.exe,,https://github.com/magicsword-io/LOLRMM/issues/89 | https://www.nvaccess.org/ | https://github.com/nvaccess/nvda/pull/17580,nvda.yaml
ocs_inventory,OCS inventory,RMM,OCS inventory is a remote monitoring and management (RMM) tool. More information will be added as it becomes available.,,2024-08-02,2024-08-02,https://ocsinventory-ng.org/,,,,,,ocsinventory.exe | ocsservice.exe,,,,https://ocsinventory-ng.org/?page_id=878&lang=en,ocs_inventory.yaml
onionshare,Onionshare,RAT,Onionshare is a remote monitoring and management (RMM) tool. More information will be added as it becomes available.,,2024-08-02,2024-08-02,https://onionshare.org/,,,,,,C:\Program Files (x86)\OnionShare\* | *\OnionShare\* | *\onionshare*.exe | OnionShare-win*.msi,,,,,onionshare.yaml
optitune,OptiTune,RMM,OptiTune is a remote monitoring and management (RMM) tool. More information will be added as it becomes available.,,2024-08-02,2024-08-02,https://www.bravurasoftware.com/optitune/,,,,,,OTService.exe | OTPowerShell.exe,,,,https://www.bravurasoftware.com/optitune/support/faq.aspx,optitune.yaml
pandora_rc_(ehorus),Pandora RC (eHorus),RMM,Pandora RC (eHorus) is a remote monitoring and management (RMM) tool. More information will be added as it becomes available.,,2024-08-02,2024-08-02,https://pandorafms.com/en/remote-control/,,,,,,ehorus standalone.exe | ehorus_agent.exe,,,,https://pandorafms.com/manual/!current/en/documentation/09_pandora_rc/01_pandora_rc_introduction,pandora_rc_(ehorus).yaml
panorama9,Panorama9,RMM,Panorama9 is a remote monitoring and management (RMM) tool. More information will be added as it becomes available.,,2024-08-02,2024-08-02,https://panorama9.com/,,,,,,p9agent*.exe,,,,https://support.panorama9.com/en/articles/1859605-what-ports-and-hosts-does-the-p9-agent-communicate-with,panorama9.yaml
parallelsaccess,Parallels Access,RMM,Parallels Access is a remote monitoring and management (RMM) tool. More information will be added as it becomes available.,,2024-08-02,2024-08-02,https://www.parallels.com/,,,,,,parallelsaccess-*.exe | TSClient.exe | prl_deskctl_agent.exe | prl_deskctl_wizard.exe | prl_pm_service.exe,,,,https://kb.parallels.com/en/129097,parallelsaccess.yaml
parsec,Parsec,RAT,"Parsec is a remote desktop streaming tool for remote access and monitoring, mainly used for gaming and collaboration. 

Remote desktop reimagined â€“ a seamless 4k experience at up to 60 frames per second with near-zero latency. 
Secure, flexible, effortless access to whatever you do, at any time, from wherever you go.

Parsec focuses on real-time graphical interaction rather than system administration but can still be abused for lateral movement and initial access.",Luca Di Bartolomeo & Matt Green,2025-03-16,2025-03-16,https://parsec.app/,Current User,True,False,Windows | Linux | macOS | Android,Remote Control | GUI Support,C:\Program Files\Parsec\* | parsecd.exe | pservice.exe,,parsecd.exe,,https://parsec.app/ | https://www.virustotal.com/gui/file/206cd186aaa431d3975eb30f682b83851ef4f81125d2004f53b681117da23ec6/behavior | https://x.com/malmoeb/status/1923255362318196951,parsec.yaml
pcanywhere,pcAnywhere,RAT,pcAnywhere is a remote monitoring and management (RMM) tool. More information will be added as it becomes available.,,2024-08-02,2024-08-02,,,,,,,awhost32.exe | awrem32.exe | pcaquickconnect.exe | winaw32.exe,,,,https://en.wikipedia.org/wiki/PcAnywhere,pcanywhere.yaml
pchelpware,PChelpware,RMM,"PChelpware (also known as PCHelpWare) is a free and open-source remote support and remote desktop software developed by the UltraVNC team. Built on VNC technology and following the RFB protocol, PChelpware is designed specifically for remote technical support scenarios, virtual training, and helpdesk operations.",Daniel Koifman (KoifSec),2025-11-12,2025-11-12,https://uvnc.com/downloads/pchelpware/,User,True,True,Windows,Remote Desktop Control | Remote Support | Screen Sharing | File Transfer,*\PcHelpWare_viewer.exe,,,,https://uvnc.com/downloads/pchelpware/,pchelpware.yaml
pcnow,Pcnow,RMM,Pcnow is a remote monitoring and management (RMM) tool. More information will be added as it becomes available.,,2024-08-02,2024-08-02,,,,,,,mwcliun.exe | pcnmgr.exe | webexpcnow.exe,,,,http://pcnow.webex.com/ - DOA as of 2024,pcnow.yaml
pcvisit,Pcvisit,RMM,Pcvisit is a remote monitoring and management (RMM) tool. More information will be added as it becomes available.,,2024-08-02,2024-08-02,https://www.pcvisit.de/,,,,,,pcvisit.exe | pcvisit_client.exe | pcvisit-easysupport.exe | pcvisit_service_client.exe,,,,https://www.pcvisit.de/,pcvisit.yaml
pdq_connect,PDQ Connect,RMM,PDQ Connect is a remote monitoring and management (RMM) tool. More information will be added as it becomes available.,,2024-08-02,2024-08-02,https://www.pdq.com/pdq-connect/,,,,,,pdq-connect*.exe | PDQConnectUpdater-*.msi,,,,https://connect.pdq.com/hc/en-us/articles/12489014928667-Collect-PDQ-Connect-Event-Logs | https://connect.pdq.com/hc/en-us/articles/19197321496219-PDQ-Connect-Output-Logs | https://connect.pdq.com/hc/en-us/articles/9518992071707-Network-Requirements,pdq_connect.yaml
pilixo,Pilixo,RMM,Pilixo is a remote monitoring and management (RMM) tool. More information will be added as it becomes available.,,2024-08-02,2024-08-02,,,,,,,rdp.exe | Pilixo_Installer*.exe,,,,https://pilixo.freshdesk.com/support/solutions/articles/9000141879-device-connectivity-and-firewalls,pilixo.yaml
pocket_cloud_(wyse),Pocket Cloud (Wyse),RMM,Pocket Cloud (Wyse) is a remote monitoring and management (RMM) tool. More information will be added as it becomes available.,,2024-08-02,2024-08-02,,,,,,,pocketcloud*.exe | pocketcloudservice.exe,,,,https://wyse-pocketcloud.informer.com/2.1/,pocket_cloud_(wyse).yaml
pocket_controller,Pocket Controller,RMM,Pocket Controller is a remote monitoring and management (RMM) tool. More information will be added as it becomes available.,,2024-08-02,2024-08-02,https://soti.net/products/soti-pocket-controller,,,,Windows,,pocketcontroller.exe | pocketcloudservice.exe | wysebrowser.exe,,,,,pocket_controller.yaml
pocket_controller_(soti_xsight),Pocket Controller (Soti Xsight),RMM,Pocket Controller (Soti Xsight) is a remote monitoring and management (RMM) tool. More information will be added as it becomes available.,,2024-08-02,2024-08-02,https://soti.net/products/soti-xsight/,,,,Windows,,pocketcontroller.exe | wysebrowser.exe | XSightService.exe,,,,https://pulse.soti.net/support/soti-xsight/help/,pocket_controller_(soti_xsight).yaml
psexec,PSEXEC,RAT,PSEXEC is a remote monitoring and management (RMM) tool. More information will be added as it becomes available.,,2024-08-02,2024-08-02,https://learn.microsoft.com/en-us/sysinternals/downloads/psexec,,,,,,psexec.exe | psexecsvc.exe,,,,https://learn.microsoft.com/en-us/sysinternals/downloads/psexec,psexec.yaml
psexec_(clone),PSEXEC (Clone),RAT,PSEXEC (Clone) is a remote monitoring and management (RMM) tool. More information will be added as it becomes available.,,2024-08-02,2024-08-02,,,,,,,paexec.exe | PAExec-*.exe | csexec.exe | remcom.exe | remcomsvc.exe | xcmd.exe | xcmdsvc.exe,,,,https://www.poweradmin.com/paexec/,psexec_(clone).yaml
pulseway,Pulseway,RMM,Pulseway is a remote monitoring and management (RMM) tool. More information will be added as it becomes available.,,2024-08-02,2024-08-02,https://www.pulseway.com/,,,,,,PCMonitorManager.exe | pcmonitorsrv.exe,,,,https://intercom.help/pulseway/en/,pulseway.yaml
putty,PuTTY,RAT,PuTTY is a remote monitoring and management (RMM) tool. More information will be added as it becomes available.,,2024-08-02,2024-08-02,https://www.chiark.greenend.org.uk/~sgtatham/putty/,,,,,,*\putty.exe,,,,,putty.yaml
putty_tray,PuTTY Tray,RAT,PuTTY Tray is a remote monitoring and management (RMM) tool. More information will be added as it becomes available.,,2024-08-02,2024-08-02,https://github.com/FauxFaux/PuTTYTray,,,,,,C:\*\puttytray.exe | *\puttytray.exe,,,,,putty_tray.yaml
qq_im-remote_assistance,QQ IM-remote assistance,RMM,QQ IM-remote assistance is a remote monitoring and management (RMM) tool. More information will be added as it becomes available.,,2024-08-02,2024-08-02,,,,,,,qq.exe | QQProtect.exe | qqpcmgr.exe,,,,https://en.wikipedia.org/wiki/Tencent_QQ,qq_im-remote_assistance.yaml
quest_kace_agent_(formerly_dell_kace),Quest KACE Agent (formerly Dell KACE),RMM,Quest KACE Agent (formerly Dell KACE) is a remote monitoring and management (RMM) tool. More information will be added as it becomes available.,,2024-08-02,2024-08-02,https://www.quest.com/kace/,,,,,,konea.exe,,,,https://support.quest.com/kb/4211365/which-network-ports-and-urls-are-required-for-the-kace-sma-appliance-to-function,quest_kace_agent_(formerly_dell_kace).yaml
quickassist,Quick Assist,RAT,Quick Assist is a remote monitoring and management (RMM) tool. More information will be added as it becomes available.,,2024-08-02,2024-08-02,https://support.microsoft.com/windows/solve-pc-problems-remotely-using-quick-assist-b077e31a-16f4-2529-1a47-21f6a9040bf3,,,,,,quickassist.exe,,,,https://github.com/magicsword-io/LOLRMM/issues/46,quickassist.yaml
radmin,RAdmin,RMM,RAdmin is a remote monitoring and management (RMM) tool. More information will be added as it becomes available.,Nasreddine Bencherchali,2024-08-05,2024-08-05,https://www.radmin.com/,,,,Windows,,C:\Program Files (x86)\Radmin Viewer 3\Radmin.exe | C:\Windows\SysWOW64\rserver30\rserver3.exe | C:\Windows\SysWOW64\rserver30\FamItrfc | C:\Windows\SysWOW64\rserver30\FamItrf2,RServer3.exe | Radmin.exe,RServer3.exe | Radmin.exe,,https://radmin-club.com/radmin/how-to-establish-a-connection-outside-of-lan/ | https://helpdesk.radmin.com/radmin3help/ | https://helpdesk.radmin.com/radmin3help/files/viewercmd.htm | https://helpdesk.radmin.com/radmin3help/files/cmd.htm,radmin.yaml
rapid7,Rapid7,RMM,Rapid7 is a remote monitoring and management (RMM) tool. More information will be added as it becomes available.,,2024-08-02,2024-08-02,https://docs.rapid7.com/insight-agent/overview/,,,,,,ir_agent.exe | rapid7_agent_core.exe | rapid7_endpoint_broker.exe,,,,https://docs.rapid7.com/insightvm/configure-communications-with-the-insight-platform/,rapid7.yaml
rdclient,RdClient,RAT,"RdClient is a slim remote desktop client for the protocols RDP, VNC and Hyper-V. It manages remote desktops in a tree view similar to the Windows Explorer.",Daniel Koifman (KoifSec),2025-11-12,2025-11-12,https://www.pierschel.com/en/software-blog/28-rdclient-en,User,True,True,Windows,Remote Desktop Access | Multiple Protocol Support | Connection Management,C:\Program Files (x86)\RdClient\* | C:\Program Files\RdClient\* | rdclient.exe | RdClientInstaller.exe | SupportTool.exe,,,,https://rdclient.en.softonic.com/ | https://geekflare.com/software/remote-desktop-client-software/,rdclient.yaml
rdcman,RDCMan,RAT,"Remote Desktop Connection Manager (RDCMan) is a free Microsoft tool developed by Julian Burger for managing multiple remote desktop connections from a single interface. Part of the Sysinternals suite, RDCMan enables IT administrators, system administrators, server lab managers, developers, and testers to organize, group, and control numerous RDP sessions efficiently.",Daniel Koifman (KoifSec),2025-11-12,2025-11-12,https://learn.microsoft.com/en-us/sysinternals/downloads/rdcman,User,True,True,Windows,Remote Desktop Management | Multiple RDP Sessions,*\RDCMan.exe | *\RDCMan-x86.exe,,,CVE-2020-0765,https://learn.microsoft.com/en-us/sysinternals/downloads/rdcman | https://dirteam.com/sander/2021/06/24/remote-desktop-connection-manager-rdcman-is-back/ | https://msrc.microsoft.com/update-guide/vulnerability/CVE-2020-0765,rdcman.yaml
rdp2tcp,rdp2tcp,RAT,rdp2tcp is a remote monitoring and management (RMM) tool. More information will be added as it becomes available.,,2024-08-02,2024-08-02,https://github.com/V-E-O/rdp2tcp,,,,Windows,,tdp2tcp.exe | rdp2tcp.py,,,,https://github.com/V-E-O/rdp2tcp,rdp2tcp.yaml
rdpview,RDPView,RAT,RDPView is a remote monitoring and management (RMM) tool. More information will be added as it becomes available.,,2024-08-02,2024-08-02,,,,,,,dwrcs.exe,,,,,rdpview.yaml
rdpwrap,rdpwrap,RAT,rdpwrap is a remote monitoring and management (RMM) tool. More information will be added as it becomes available.,,2024-08-02,2024-08-02,https://github.com/stascorp/rdpwrap,,,,,,RDPWInst.exe | RDPCheck.exe | RDPConf.exe,,,,https://github.com/stascorp/rdpwrap,rdpwrap.yaml
realvnc,RealVNC,RAT,RealVNC is a remote monitoring and management (RMM) tool. More information will be added as it becomes available.,,2024-08-02,2024-08-02,https://www.realvnc.com/en/connect/,,,,,,,,,,,realvnc.yaml
remcos,Remcos,RMM,Remcos is a remote monitoring and management (RMM) tool. More information will be added as it becomes available.,,2024-08-02,2024-08-02,,,,,,,remcos*.exe,,,,,remcos.yaml
remmina,Remmina,RAT,Remmina is a remote monitoring and management (RMM) tool. More information will be added as it becomes available.,,2024-08-02,2024-08-02,https://remmina.org/,,,,,,,,,,,remmina.yaml
remmon,Remmon,RMM,Remote monitoring tool for Windows and Linux written in Go.,Daniel Koifman (KoifSec),2025-11-12,2025-11-12,https://github.com/Netzwerkfehler/remmon,User,True,False,Windows | Linux,Remote Monitoring,*\\Remmon.exe,,,,https://github.com/Netzwerkfehler/remmon/releases/tag/v1.1.0,remmon.yaml
remobo,Remobo,RMM,Remobo is a remote monitoring and management (RMM) tool. More information will be added as it becomes available.,,2024-08-02,2024-08-02,,,,,,,remobo.exe | remobo_client.exe | remobo_tracker.exe,,,,https://www.remobo.com - DOA as of 2024,remobo.yaml
remote.it,Remote.it,RMM,Remote.it is a remote monitoring and management (RMM) tool. More information will be added as it becomes available.,,2024-08-02,2024-08-02,https://www.remote.it/,,,,Windows,,remote-it-installer.exe | remote.it.exe | remoteit.exe,,,,https://docs.remote.it/introduction/get-started,remote.it.yaml
remote_desktop_manager_(devolutions),Remote Desktop Manager (Devolutions),RAT,Remote Desktop Manager (Devolutions) is a remote monitoring and management (RMM) tool. More information will be added as it becomes available.,,2024-08-02,2024-08-02,https://devolutions.net/,,,,,,,,,,,remote_desktop_manager_(devolutions).yaml
remote_desktop_plus,Remote Desktop Plus,RAT,Remote Desktop Plus is a remote monitoring and management (RMM) tool. More information will be added as it becomes available.,,2024-08-02,2024-08-02,https://www.donkz.nl/,,,,,,rdp.exe,,,,https://www.donkz.nl/,remote_desktop_plus.yaml
remote_manipulator_system,Remote Manipulator System,RMM,Remote Manipulator System is a remote monitoring and management (RMM) tool. More information will be added as it becomes available.,,2024-08-02,2024-08-02,https://rmansys.ru/,,,,,,rfusclient.exe | rutserv.exe,,,,https://rmansys.ru/files/,remote_manipulator_system.yaml
remote_utilities,Remote Utilities,RMM,Remote Utilities is a remote monitoring and management (RMM) tool. More information will be added as it becomes available.,,2024-08-02,2024-08-02,https://www.remoteutilities.com/,,,,,,rutview.exe | rutserv.exe,,,,https://www.remoteutilities.com/download/,remote_utilities.yaml
remotecall,RemoteCall,RMM,RemoteCall is a remote monitoring and management (RMM) tool. More information will be added as it becomes available.,,2024-08-02,2024-08-02,https://www.remotecall.com/,,,,Windows,,rcengmgru.exe | rcmgrsvc.exe | rxstartsupport.exe | rcstartsupport.exe | raautoup.exe | agentu.exe | remotesupportplayeru.exe,,,,https://help.remotecall.com/hc/en-us/articles/360005128814--RemoteCall-Server-List-For-Firewall,remotecall.yaml
remotepass,RemotePass,RMM,RemotePass is a remote monitoring and management (RMM) tool. More information will be added as it becomes available.,,2024-08-02,2024-08-02,https://www.remotepass.com/,,,,Windows,,remotepass-access.exe | rpaccess.exe | rpwhostscr.exe,,,,https://www.remotepass.com/rpaccess.html - DOA as of 2024,remotepass.yaml
remotepc,RemotePC,RMM,RemotePC is a remote monitoring and management (RMM) tool. More information will be added as it becomes available.,,2024-08-02,2024-08-02,https://www.remotepc.com/,,,,Windows,,C:\Program Files (x86)\RemotePC\* | Idrive.File-Transfer | *\RemotePC\* | remotepcservice.exe | RemotePC.exe | remotepchost.exe | idrive.RemotePCAgent | rpcsuite.exe | *\RemotePCService.exe | RemotePCService.exe,,,,https://www.remotedesktop.com/helpdesk/faq-firewall,remotepc.yaml
remoteripple,Remote Ripple,RMM,"Remote Ripple is a free VNC viewer client developed by GlavSoft (the creators of TightVNC) for remote desktop access and control. It is a modern, lightweight viewer based on TightVNC technology that allows users to remotely access and control.",Daniel Koifman (KoifSec),2025-11-12,2025-11-12,https://remoteripple.com,User,True,False,Windows | Mac | Android | iOS,Remote Control | Remote View | Clipboard Exchange | File Transfer | Screen Capture,C:\Program Files\Remote Ripple\* | C:\Program Files (x86)\Remote Ripple\* | RemoteRipple.exe,,,,https://remoteripple.com,remoteripple.yaml
remoteutilities,RemoteUtilities,RMM,RemoteUtilities is a remote monitoring and management (RMM) tool. More information will be added as it becomes available.,,2024-08-02,2024-08-02,https://www.remoteutilities.com/,,,,,,rutview.exe | *\Remote Manipulator System - Server\* | C:\Program Files\Remote Utilities\* | *\Remote Utilities\* | rutserv.exe | *\rutserv.exe,,,,,remoteutilities.yaml
remoteview,RemoteView,RMM,RemoteView is a remote monitoring and management (RMM) tool. More information will be added as it becomes available.,,2024-08-02,2024-08-02,https://content.rview.com/,,,,,,remoteview.exe | rv.exe | rvagent.exe | rvagtray.exe,,,,https://help.rview.com/hc/en-us/articles/360005175994--RemoteView-Server-list-for-firewall,remoteview.yaml
res_automation_manager,RES Automation Manager,RMM,RES Automation Manager is a remote monitoring and management (RMM) tool. More information will be added as it becomes available.,,2024-08-02,2024-08-02,https://www.ivanti.com/company/history/res-software,,,,,,wisshell*.exe | wmc.exe | wmc_deployer.exe | wmcsvc.exe,,,,https://forums.ivanti.com/s/article/INFO-Which-ports-does-Ivanti-Automation-use?language=en_US&ui-force-components-controllers-recordGlobalValueProvider.RecordGvp.getRecord=1,res_automation_manager.yaml
rocketremotedesktop,Rocket Remote Desktop,RMM,Rocket Remote Desktop is a remote monitoring and management (RMM) tool. More information will be added as it becomes available.,,2024-08-02,2024-08-02,https://www.rocketsoftware.com/en-us/products/remote-desktop,,,,Windows,,RDConsole.exe | RocketRemoteDesktop_Setup.exe,,,,,rocketremotedesktop.yaml
royal_apps,Royal Apps,RMM,Royal Apps is a remote monitoring and management (RMM) tool. More information will be added as it becomes available.,,2024-08-02,2024-08-02,https://www.royalapps.com/,,,,Windows,,royalserver.exe | royalts.exe,,,,https://www.royalapps.com/ts/win/download,royal_apps.yaml
royal_server,Royal Server,RMM,Royal Server is a remote monitoring and management (RMM) tool. More information will be added as it becomes available.,,2024-08-02,2024-08-02,https://www.royalapps.com/server/,,,,,,,,,,https://royalapps.com/server/main/features,royal_server.yaml
royal_ts,Royal TS,RMM,Royal TS is a remote monitoring and management (RMM) tool. More information will be added as it becomes available.,,2024-08-02,2024-08-02,https://www.royalapps.com/ts/,,,,,,royalts.exe,,,,,royal_ts.yaml
rport,RPort,RMM,RPort is a remote monitoring and management (RMM) tool. More information will be added as it becomes available.,,2024-08-02,2024-08-02,https://kb.rport.io/,,,,,,rport.exe,,,,https://kb.rport.io/using-the-remote-access,rport.yaml
rudesktop,RuDesktop,RMM,RuDesktop is a remote monitoring and management (RMM) tool. More information will be added as it becomes available.,,2024-08-02,2024-08-02,https://rudesktop.ru/,,,,,,rd.exe | rudesktop*.exe,,,,https://rudesktop.ru,rudesktop.yaml
runsmart,RunSmart,RMM,RunSmart is a remote monitoring and management (RMM) tool. More information will be added as it becomes available.,,2024-08-02,2024-08-02,https://runsmart.io/,,,,,,,,,,,runsmart.yaml
rustdesk,RustDesk,RMM,RustDesk is a remote monitoring and management (RMM) tool. More information will be added as it becomes available.,,2024-08-02,2024-08-02,https://rustdesk.com/,,Yes,,Windows | Linux | MacOS,,rustdesk*.exe | rustdesk.exe | C:\Users\*\AppData\Local\rustdesk\rustdesk.exe | C:\Users\*\AppData\Local\rustdesk\* | C:\Program Files\RustDesk,,,,https://rustdesk.com/docs/en/,rustdesk.yaml
s3_browser,S3 Browser,RAT,S3 Browser is a remote monitoring and management (RMM) tool. More information will be added as it becomes available.,,2024-08-02,2024-08-02,https://s3browser.com/,,,,,,C:\Program Files (x86)\S3 Browser\* | *\S3 Browser\* | *\s3browser*.exe,,,,,s3_browser.yaml
screenconnect,ScreenConnect,RMM,ScreenConnect is a remote monitoring and management (RMM) tool. More information will be added as it becomes available.,"Ali Alwashali, Nasreddine Bencherchali",2023-10-01,2023-10-01,https://www.connectwise.com,,14-Days Free Trial,,Android | IOS | Linux | Mac | Windows,Command Line Support | File Transfer | Install Windows updates | Receive notification when user performs a predefined event | Remote Command Line | Remote Control | Sound Capture | Start / Stop services | View event logs,C:\Program Files (x86)\ScreenConnect Client (Random)\ScreenConnect.ClientService.exe | Remote Workforce Client.exe | *\*\ScreenConnect.ClientService.exe | C:\Program Files (x86)\ScreenConnect Client (<string ID>)\* | *\ScreenConnect Client*\* | *\*\ScreenConnect.WindowsClient.exe | screenconnect*.exe | screenconnect.windowsclient.exe | Remote Workforce Client.exe | screenconnect*.exe | ConnectWiseControl*.exe | connectwise*.exe | screenconnect.windowsclient.exe | screenconnect.clientservice.exe,,,,https://thedfirreport.com/2023/09/25/from-screenconnect-to-hive-ransomware-in-61-hours/,screenconnect.yaml
