slug,name,category,description,author,created,last_modified,website,privileges,free,verification,supported_os,capabilities,installation_paths,pe_original_names,pe_filenames,vulnerabilities,references,source_file
jollysfastvnc,JollysFastVNC,RAT,JollysFastVNC is a remote monitoring and management (RMM) tool. More information will be added as it becomes available.,,2024-08-02,2024-08-02,https://www.jinx.de/JollysFastVNC.html,,,,,,,,,,,jollysfastvnc.yaml
jump_cloud,Jump Cloud,RMM,Jump Cloud is a remote monitoring and management (RMM) tool. More information will be added as it becomes available.,,2024-08-02,2024-08-02,https://jumpcloud.com/platform/remote-assistance,,,,,,JumpCloud*.exe,,,,https://jumpcloud.com/support/understand-remote-assist-agent,jump_cloud.yaml
jump_desktop,Jump Desktop,RMM,Jump Desktop is a remote monitoring and management (RMM) tool. More information will be added as it becomes available.,,2024-08-02,2024-08-02,https://jumpdesktop.com/,,,,,,jumpclient.exe | jumpdesktop.exe | jumpservice.exe | jumpconnect.exe | jumpupdater.exe,,,,https://support.jumpdesktop.com/hc/en-us/articles/360042490351-Administrators-Guide-For-Jump-Desktop-Connect,jump_desktop.yaml
kabuto,Kabuto,RMM,Kabuto is a remote monitoring and management (RMM) tool. More information will be added as it becomes available.,,2024-08-02,2024-08-02,,,,,,,Kabuto.App.Runner.exe,,,,https://www.repairtechsolutions.com/documentation/kabuto/,kabuto.yaml
kaseya,Kaseya (VSA),RMM,Kaseya (VSA) aka Unigma is a remote monitoring and management (RMM) tool. More information will be added as it becomes available.,Nasreddine Bencherchali,2024-08-05,2024-08-05,https://www.kaseya.com/,,,,Windows,,C:\Program Files (x86)\Kaseya\ | C:\ProgramData\Kaseya\,,agentmon.exe | KaUpdHlp.exe | KaUsrTsk.exe,,https://helpdesk.kaseya.com/hc/en-gb/articles/229012608-Software-Deployment-URL-Port-Requirements | https://helpdesk.kaseya.com/hc/en-gb/articles/229009708-Live-Connect-Log-File-Locations | https://ruler-project.github.io/ruler-project/RULER/remote/Kaseya/ | https://helpdesk.kaseya.com/hc/en-gb/articles/229009708-Live-Connect-Log-File-Locations,kaseya.yaml
khelpdesk,KHelpDesk,RMM,KHelpDesk is a remote monitoring and management (RMM) tool. More information will be added as it becomes available.,,2024-08-02,2024-08-02,https://www.khelpdesk.com.br/,,,,,,KHelpDesk.exe,,,,https://www.khelpdesk.com.br/en-us,khelpdesk.yaml
kickidler,KickIdler,RMM,KickIdler is a remote monitoring and management (RMM) tool. More information will be added as it becomes available.,,2024-08-02,2024-08-02,https://www.kickidler.com/,,,,,,grabberEM.*msi | grabberTT*.msi,,,,https://www.kickidler.com/for-it/faq/,kickidler.yaml
kitty,KiTTY,RAT,KiTTY is a remote monitoring and management (RMM) tool. More information will be added as it becomes available.,,2024-08-02,2024-08-02,https://www.9bis.net/kitty/,,,,,,C:\*\kitty.exe | *\kitty.exe,,,,,kitty.yaml
koofr,Koofr,RAT,Koofr is a remote monitoring and management (RMM) tool. More information will be added as it becomes available.,,2024-08-02,2024-08-02,,,,,,,,,,,,koofr.yaml
labteachconnectwiseautomate,LabTeach (Connectwise Automate),RMM,LabTeach (Connectwise Automate) is a remote monitoring and management (RMM) tool. More information will be added as it becomes available.,,2024-08-02,2024-08-02,https://www.connectwise.com/platform/automate,,,,Windows,,ltsvc.exe,,,,,labteachconnectwiseautomate.yaml
labtech_rmm_(now_connectwise_automate),LabTech RMM (Now ConnectWise Automate),RMM,LabTech RMM (Now ConnectWise Automate) is a remote monitoring and management (RMM) tool. More information will be added as it becomes available.,,2024-08-02,2024-08-02,https://www.connectwise.com/platform/automate,,,,,,ltsvc.exe | ltsvcmon.exe | lttray.exe,,,,,labtech_rmm_(now_connectwise_automate).yaml
landesk,LANDesk,RMM,LANDesk is a remote monitoring and management (RMM) tool. More information will be added as it becomes available.,,2024-08-02,2024-08-02,https://www.landesk.com/,,,,,,issuser.exe | landeskagentbootstrap.exe | LANDeskPortalManager.exe | ldinv32.exe | ldsensors.exe | C:\Program Files (x86)\LANDesk\* | *\LANDesk\* | *\issuser.exe | *\softmon.exe | *\tmcsvc.exe,,,,https://forums.ivanti.com/s/article/URL-exception-list-for-Ivanti-Security-Controls?language=en_US,landesk.yaml
laplink_everywhere,Laplink Everywhere,RMM,Laplink Everywhere is a remote monitoring and management (RMM) tool. More information will be added as it becomes available.,,2024-08-02,2024-08-02,https://everywhere.laplink.com/,,,,,,laplink.exe | laplink-everywhere-setup*.exe | laplinkeverywhere.exe | llrcservice.exe | serverproxyservice.exe | OOSysAgent.exe,,,,https://everywhere.laplink.com/docs,laplink_everywhere.yaml
laplink_gold,Laplink Gold,RMM,Laplink Gold is a remote monitoring and management (RMM) tool. More information will be added as it becomes available.,,2024-08-02,2024-08-02,https://web.laplink.com/product/laplink-gold,,,,,,tsircusr.exe | laplink.exe,,,,https://web.laplink.com/product/laplink-gold,laplink_gold.yaml
level.io,Level.io,RMM,Level.io is a remote monitoring and management (RMM) tool. More information will be added as it becomes available.,,2024-08-02,2024-08-02,https://level.io/,,,,,,level-windows-amd64.exe | level.exe | level-remote-control-ffmpeg.exe,,,,https://docs.level.io/1.0/admin-guides/troubleshooting-agent-issues,level.io.yaml
level,Level,RMM,Level is a remote monitoring and management (RMM) tool. Threat actors ...,"Christian Henriksen, ITM8 | Improsec",2024-02-11,2024-02-11,https://level.io/,User,Free,True,Windows,File Transfer | File System Access | Remote Control | Automation & Scripting,C:\Program Files\Level\*,,level.exe,,https://dfirtnt.wordpress.com/2023/09/05/rmm-level-io-forensic-artifacts-and-evidence/ | https://docs.level.io/en/articles/9926456-level-watchdog-task,level.yaml
levelio,Level.io,RMM,Level.io is a remote monitoring and management (RMM) tool. More information will be added as it becomes available.,,2024-08-02,2024-08-02,https://level.io/,,,,Windows,,level-windows-amd64.exe | level.exe | level-remote-control-ffmpeg.exe,,,,https://docs.level.io/1.0/admin-guides/troubleshooting-agent-issues,levelio.yaml
lite_manager,Lite Manager,RMM,Lite Manager is a remote monitoring and management (RMM) tool. More information will be added as it becomes available.,,2024-08-02,2024-08-02,https://www.litemanager.com/,,,,,,C:\Program Files\LiteManager Pro – Viewer\* | *\LiteManager Pro – Viewer\* | *\LMNoIpServer.exe,,,,,lite_manager.yaml
litemanager,LiteManager,RMM,LiteManager is a remote monitoring and management (RMM) tool. More information will be added as it becomes available.,,2024-08-02,2024-08-02,https://www.litemanager.com/,,,,,,lmnoipserver.exe | ROMFUSClient.exe | romfusclient.exe | romviewer.exe | romserver.exe | ROMServer.exe,,,,https://www.litemanager.com/articles/LiteManager_remote_access_to_a_desktop_via_the_Internet_or_LAN/,litemanager.yaml
logmein,LogMeIn,RMM,LogMeIn is a remote monitoring and management (RMM) tool. More information will be added as it becomes available.,Nasreddine Bencherchali,2024-08-05,2024-08-05,https://www.logmein.com/,,,,,,,,lmiguardiansvc.exe | lmiignition.exe | logmeinsystray.exe | logmein.exe,,https://support.logmeininc.com/central/help/allowlisting-and-firewall-configuration,logmein.yaml
logmein_rescue,LogMeIn rescue,RMM,LogMeIn rescue is a remote monitoring and management (RMM) tool. More information will be added as it becomes available.,,2024-08-02,2024-08-02,https://www.logmein.com/products/rescue,,,,,,support-logmeinrescue*.exe | support-logmeinrescue.exe | lmi_rescue.exe | C:\Users\*\AppData\Local\LogMeIn Rescue Applet\LMIR*.tmp\lmi_rescue.exe | C:\Users\*\AppData\Local\LogMeIn Rescue Applet\LMIR*.tmp\lmi_rescue_srv.exe | C:\Users\*\AppData\Local\LogMeIn Rescue Applet\LMIR*.tmp\lmi_rescue.exe,,,,https://support.logmeinrescue.com/rescue/help/allowlisting-and-rescue,logmein_rescue.yaml
manage_engine_(desktop_central),Manage Engine (Desktop Central),RMM,Manage Engine (Desktop Central) is a remote monitoring and management (RMM) tool. More information will be added as it becomes available.,,2024-08-02,2024-08-02,https://desktopcentral.manageengine.com,,,,,,dcagentservice.exe | dcagentregister.exe,,,,,manage_engine_(desktop_central).yaml
manageengine,ManageEngine,RMM,ManageEngine is a remote monitoring and management (RMM) tool. More information will be added as it becomes available.,,2024-08-02,2024-08-02,https://www.manageengine.com/,,,,,,InstallShield Setup.exe | ManageEngine_Remote_Access_Plus.exe | *\dcagentservice.exe | C:\Program Files (x86)\DesktopCentral_Agent\bin\* | *\DesktopCentral_Agent\bin\*,,,,,manageengine.yaml
manageengine_rmm_central,ManageEngine RMM Central,RMM,ManageEngine RMM Central is a remote monitoring and management (RMM) tool. More information will be added as it becomes available.,,2024-08-02,2024-08-02,https://www.manageengine.com/remote-monitoring-management/,,,,,,,,,,,manageengine_rmm_central.yaml
manageengine_servicedesk_plus,ManageEngine ServiceDesk Plus,RMM,"ManageEngine ServiceDesk Plus is an IT service management (ITSM) and help desk software that includes remote control capabilities for IT support teams. The software provides comprehensive IT service management features including incident management, asset management, and remote desktop support.",Michael Haag,2026-01-15,2026-01-15,https://www.manageengine.com/products/service-desk/,SYSTEM,Trial Available,Code-signed,Windows | Linux,Remote Control | Remote Desktop | IT Service Management | Incident Management | Asset Management | Help Desk,ManageEngine_ServiceDesk_Plus.exe | ManageEngine_ServiceDesk_Plus.bin | ISBEW64.exe | C:\Program Files\ManageEngine\ServiceDesk\* | C:\Program Files (x86)\ManageEngine\ServiceDesk\*,InstallShield Setup.exe,ManageEngine_ServiceDesk_Plus.exe | ManageEngine_ServiceDesk_Plus.bin | ISBEW64.exe,,https://github.com/magicsword-io/LOLRMM/issues/50 | https://www.manageengine.com/products/service-desk/download.html | https://www.virustotal.com/gui/file/177bfdbe81bb4756d1d324ddf1bff4350252f0efd8a7f5c8b60a3a8e882affbd/details,manageengine_servicedesk_plus.yaml
megasync,MEGAsync,RAT,MEGAsync is a remote monitoring and management (RMM) tool. More information will be added as it becomes available.,,2024-08-02,2024-08-02,https://mega.io/desktop,,,,,,C:\Users\*\AppData\Local\MEGAsync\* | *Users\*\AppData\Local\MEGAsync\* | *ProgramData\MEGAsync\* | *\MEGAsyncSetup64.exe | *\MEGAupdater.exe,,,,,megasync.yaml
meshcentral,MeshCentral,RMM,MeshCentral is a remote monitoring and management (RMM) tool. MeshAgent used along with MeshCentral to remotely manage computers. MeshAgent can execute commands on the target host by leveraging win-console to obscure their activities and win-dispatcher to run malicious code through IPC with child processes.,@kostastsale,2024-09-20,2024-09-20,https://meshcentral.com/,SYSTEM,Yes,N/A,Windows | Linux | MacOS | FreeBSD,Remote Desktop & Terminal | Remote File Access | Text and Voice Chat | Server File Storage | Real-time User interface | Port Forwarding,meshcentral*.exe | meshagent*.exe | /usr/local/mesh_services/meshagent/meshagent/* | /usr/local/mesh_services/meshagent/*,,MeshAgent.exe,CVE-2024-26135,https://ylianst.github.io/MeshCentral/meshcentral/ | https://github.com/Ylianst/MeshAgent,meshcentral.yaml
microsoft_quick_assist,Microsoft Quick Assist,RAT,Microsoft Quick Assist is a remote monitoring and management (RMM) tool. More information will be added as it becomes available.,,2024-08-02,2024-08-02,https://support.microsoft.com/windows/solve-pc-problems-remotely-using-quick-assist-b077e31a-16f4-2529-1a47-21f6a9040bf3,,,,,,quickassist.exe,,,,https://support.microsoft.com/en-us/windows/install-quick-assist-c17479b7-a49d-4d12-938c-dbfb97c88bca,microsoft_quick_assist.yaml
microsoft_rdp,Microsoft RDP,RAT,Microsoft RDP is a remote monitoring and management (RMM) tool. More information will be added as it becomes available.,,2024-08-02,2024-08-02,https://learn.microsoft.com/en-us/previous-versions/remote-desktop-client/remote-desktop-windows-urdc,,,,Windows,,termsrv.exe | mstsc.exe | Microsoft Remote Desktop,,,,https://learn.microsoft.com/en-us/windows-server/remote/remote-desktop-services/clients/windows,microsoft_rdp.yaml
microsoft_tsc,Microsoft TSC,RMM,Microsoft TSC is a remote monitoring and management (RMM) tool. More information will be added as it becomes available.,,2024-08-02,2024-08-02,,,,,,,termsrv.exe | mstsc.exe,,,,https://learn.microsoft.com/en-us/troubleshoot/windows-server/remote/terminal-server-startup-connection-application,microsoft_tsc.yaml
mikogo,Mikogo,RMM,Mikogo is a remote monitoring and management (RMM) tool. More information will be added as it becomes available.,,2024-08-02,2024-08-02,,,,,,,mikogo.exe | mikogo-starter.exe | mikogo-service.exe | mikogolauncher.exe | C:\Users\*\AppData\Roaming\Mikogo\* | *Users\*\AppData\Roaming\Mikogo\* | *\Mikogo-Service.exe | *\Mikogo-Screen-Service.exe,,,,https://mikogo.zendesk.com/hc/en-us/articles/214072478-Which-IP-addresses-do-we-use-for-our-services,mikogo.yaml
mionet_(also_known_as_wd_anywhere_access),MioNet (Also known as WD Anywhere Access),RMM,MioNet (Also known as WD Anywhere Access) is a remote monitoring and management (RMM) tool. More information will be added as it becomes available.,,2024-08-02,2024-08-02,,,,,,,mionet.exe | mionetmanager.exe,,,,,mionet_(also_known_as_wd_anywhere_access).yaml
mionet_(wd_anywhere_access),MioNet (WD Anywhere Access),RMM,MioNet (WD Anywhere Access) is a remote monitoring and management (RMM) tool. More information will be added as it becomes available.,,2024-08-02,2024-08-02,,,,,,,mionet.exe | mionetmanager.exe,,,,https://en.wikipedia.org/wiki/WD_Anywhere_Access - DOA as of 2016,mionet_(wd_anywhere_access).yaml
miradore,Miradore,RMM,"Miradore is a mobile device management (MDM) and remote monitoring and management (RMM) tool founded in 2006 as a Finnish software company. In 2022, Miradore was acquired by GoTo and is now part of the LogMeIn portfolio of IT solutions. The tool is trusted by over 2,700 customers in more than 100 countries, managing over 900,000 devices globally. Miradore has been observed being used in cyber incidents, including phishing campaigns where the installer was renamed and delivered to establish unauthorized remote access.",Michael Haag,2026-01-15,2026-01-15,https://www.miradore.com/,SYSTEM,Free tier available,Code-signed by Sectigo,Windows | Mac | Linux | iOS | Android,Remote Control | Remote Access | Device Management | Software Deployment | Patch Management | Inventory Management | Mobile Device Management,C:\Program Files\Miradore\OnlineClient\bin\* | *\Miradore\*,,StatementView.msi,,https://github.com/magicsword-io/LOLRMM/issues/118 | https://www.virustotal.com/gui/file/fedf9d82fb1349a5eecf0fad4a9d9eac7e160130e563b9bd3328b5f04891bbd6/details | https://app.any.run/tasks/5d088796-fb67-45bb-9ee0-369b502522fc | https://www.miradore.com/,miradore.yaml
mobaxterm,MobaXterm,RAT,MobaXterm is a remote monitoring and management (RMM) tool. More information will be added as it becomes available.,,2024-08-02,2024-08-02,https://mobaxterm.mobatek.net/,,,,,,C:\*\MobaXterm_installer_12.1.msi | *\MobaXterm_installer_*.msi | *\Mobatek\MobaXterm\*,,,,,mobaxterm.yaml
mocha_vnc_lite,Mocha VNC Lite,RAT,Mocha VNC Lite is a remote monitoring and management (RMM) tool. More information will be added as it becomes available.,,2024-08-02,2024-08-02,,,,,,,This installs a modified VNC and cannot be blocked by path separate from VNC | This installs a modified VNC and cannot be blocked by path separate from VNC | *\RealVNC\VNC4\*,,,,,mocha_vnc_lite.yaml
mousewithoutborders,Mouse Without Borders,RAT,"Mouse Without Borders is a Microsoft Garage utility that lets you control up to four Windows computers with a single keyboard and mouse, with clipboard sharing and simple drag-and-drop file transfers.",Microsoft,2011-09-12,2011-09-12,https://www.microsoft.com/en-us/download/details.aspx?id=35460,User; optional Service Mode for elevated apps,True,True,Windows,Multi-computer input sharing | Clipboard sharing | Drag-and-drop file transfer (up to 100 MB) | Optional service for elevated app control,C:\Program Files (x86)\Microsoft Garage\Mouse without Borders\*,MouseWithoutBorders.exe,MouseWithoutBorders.exe,,https://www.microsoft.com/en-us/download/details.aspx?id=35460 | https://learn.microsoft.com/windows/powertoys/mouse-without-borders | https://github.com/microsoft/PowerToys/issues/29700,mousewithoutborders.yaml
mremoteng,mRemoteNG,RAT,mRemoteNG is a remote monitoring and management (RMM) tool. More information will be added as it becomes available.,,2024-08-02,2024-08-02,https://mremoteng.org/,,,,,,mRemoteNG.exe | C:\Program Files (x86)\mRemoteNG\* | *\mRemoteNG\* | *\mRemoteNG.exe | c:\Program Files (x86)%\mRemoteNG | *%\mRemoteNG | mRemoteNG-Installer-*.msi | *\mRemoteNG.exe,,,,https://github.com/mRemoteNG/mRemoteNG,mremoteng.yaml
msp360,MSP360,RMM,MSP360 is a remote monitoring and management (RMM) tool. More information will be added as it becomes available.,,2024-08-02,2024-08-02,https://www.msp360.com/,,,,,,Online Backup.exe | CBBackupPlan.exe | Cloud.Backup.Scheduler.exe | Cloud.Backup.RM.Service.exe | cbb.exe | CloudRaService.exe | CloudRaSd.exe | CloudRaCmd.exe | CloudRaUtilities.exe | Remote Desktop.exe | Connect.exe,,,,https://kb.msp360.com/managed-backup-service/mbs-tcp-ports-configuration#,msp360.yaml
mstsc,mstsc,RAT,mstsc is a remote monitoring and management (RMM) tool. More information will be added as it becomes available.,,2024-08-02,2024-08-02,,,,,,,C:\Windows\System32\mstsc.exe | *Windows\System32\mstsc.exe,,,,,mstsc.yaml
multcloud,MultCloud,RAT,MultCloud is a remote monitoring and management (RMM) tool. More information will be added as it becomes available.,,2024-08-02,2024-08-02,https://www.multcloud.com/,,,,,,requires sign up | requires sign up,,,,,multcloud.yaml
mygreenpc,MyGreenPC,RMM,MyGreenPC is a remote monitoring and management (RMM) tool. More information will be added as it becomes available.,,2024-08-02,2024-08-02,https://mygreenpc.com/,,,,,,mygreenpc.exe,,,,http://www.mygreenpc.com/,mygreenpc.yaml
myivo,MyIVO,RMM,MyIVO is a remote monitoring and management (RMM) tool. More information will be added as it becomes available.,,2024-08-02,2024-08-02,,,,,,,myivomgr.exe | myivomanager.exe,,,,https://myivo.com,myivo.yaml
n-able_advanced_monitoring_agent,N-Able Advanced Monitoring Agent,RMM,N-Able Advanced Monitoring Agent is a remote monitoring and management (RMM) tool. More information will be added as it becomes available.,,2024-08-02,2024-08-02,https://www.n-able.com/features/advanced-monitoring-agent,,,,,,Agent_*_RW.exe | BASEClient.exe | BASupApp.exe | BASupSrvc.exe | BASupSrvcCnfg.exe | BASupTSHelper.exe,,,,https://documentation.n-able.com/takecontrol/troubleshooting/Content/kb/Take-Control-Standalone-Ports-and-Domains-Firewall-and-AV-Exclusions.htm,n-able_advanced_monitoring_agent.yaml
n-able_remote_access_software,N-ABLE Remote Access Software,RMM,N-ABLE Remote Access Software is a remote monitoring and management (RMM) tool. More information will be added as it becomes available.,,2024-08-02,2024-08-02,https://www.n-able.com/features/remote-access,,,,,,,,,,,n-able_remote_access_software.yaml
n-ableadvancedmonitoringagent,N-Able Advanced Monitoring Agent,RMM,N-Able Advanced Monitoring Agent is a remote monitoring and management (RMM) tool. More information will be added as it becomes available.,,2024-08-02,2024-08-02,https://www.n-able.com/features/advanced-monitoring-agent,,,,,,BASupSrvc.exe | winagent.exe | BASupApp.exe | BASupTSHelper.exe | Agent_*_RW.exe | BASEClient.exe | BASupSrvcCnfg.exe,,,,https://documentation.n-able.com/takecontrol/troubleshooting/Content/kb/Take-Control-Standalone-Ports-and-Domains-Firewall-and-AV-Exclusions.htm,n-ableadvancedmonitoringagent.yaml
naverisk,Naverisk,RMM,Naverisk is a remote monitoring and management (RMM) tool. More information will be added as it becomes available.,,2024-08-02,2024-08-02,https://www.naverisk.com/,,,,,,AgentSetup-*.exe,,,,http://kb.naverisk.com/en/articles/2811223-deploying-naverisk-agents,naverisk.yaml
netbird,NetBird,RAT,"NetBird is an open-source VPN and remote access platform that provides secure peer-to-peer connectivity. It has been observed being leveraged in spear phishing campaigns across Europe, Africa, Canada, the Middle East, and South Asia, targeting financial executives and CFOs. The tool was deployed as part of multi-stage phishing attacks by threat actors including APT MuddyWater.",Michael Haag,2026-01-15,2026-01-15,https://netbird.io/,User,Yes (Open Source),Open Source,Windows | Linux | macOS | Android | iOS,Remote Access | VPN Connectivity | Peer-to-Peer Networking | Secure Tunneling | Network Management,C:\Program Files\Netbird\netbird.exe | C:\Program Files\Netbird\netbird-ui.exe | C:\ProgramData\Netbird\* | /usr/bin/netbird | /usr/local/bin/netbird | /opt/netbird/* | netbird.exe | netbird-ui.exe | netbird,,netbird.exe | netbird-ui.exe | netbird,,https://github.com/magicsword-io/LOLRMM/issues/81 | https://www.trellix.com/en-in/blogs/research/a-flyby-on-the-cfos-inbox-spear-phishing-campaign-targeting-financial-executives-with-netbird-deployment/ | https://hunt.io/blog/apt-muddywater-deploys-multi-stage-phishing-to-target-cfos | https://netbird.io/use-cases/remote-access | https://github.com/netbirdio/netbird,netbird.yaml
netlock_rmm,NetLock RMM,RMM,NetLock RMM is an open source Remote Management and Monitoring tool with a paid support and cloud offering.,Tyler Schultz,2025-07-18,2025-07-18,https://www.netlockrmm.com/,,,,Windows | Linux | MacOS,,NetLock_RMM_Agent_Installer.exe | NetLock_RMM_Agent_Installer | /var/0x101_Cyber_Security/* | /Library/Application Support/0x101_Cyber_Security/* | /usr/local/bin/0x101_Cyber_Security/Netlock_RMM/* | /usr/0x101_Cyber_Security/Netlock_RMM/* | C:\ProgramData\0x101 Cyber Security\NetLock RMM\Comm Agent\* | C:\Program Files\0x101 Cyber Security\NetLock RMM\UserAgent\NetLock_RMM_User_Process.exe | C:\Program Files\0x101 Cyber Security\NetLock RMM\UserAgent\NetLock_RMM_User_UAC.exe,,,,https://www.netlockrmm.com | https://github.com/0x101-Cyber-Security/NetLock-RMM,netlock_rmm.yaml
netmonitor,Net Monitor for Employees,RMM,"Net Monitor for Employees Professional is a commercial workforce monitoring tool developed by NetworkLookout. Marketed for employee productivity tracking, the software provides capabilities that extend well beyond passive screen monitoring, including reverse shell connections, remote desktop control, file management, and the ability to customize service and process names during installation. These features, while designed for legitimate administrative use, make it an attractive tool for threat actors seeking to blend into enterprise environments without deploying traditional malware.",Daniel Koifman (KoifSec),2026-02-12,2026-02-12,https://networklookout.com/,User,True,True,Windows | MacOS | Linux,Remote Desktop Access | Screen Management | Remote Shell | Connection Management,C:\Program Files (x86)\Net Monitor for Employees Pro\* | C:\Program Files\Net Monitor for Employees Pro\* | nmep_agtconfig.exe | nmep_ctrlagent.exe | nmep_ctrlagentsvc.exe | winpty-agent.exe | winpty-agent64.exe,,,,https://www.huntress.com/blog/employee-monitoring-simplehelp-abused-in-ransomware-operations | https://networklookout.com/,netmonitor.yaml
netop,Netop,RMM,Netop is a remote monitoring and management (RMM) tool. More information will be added as it becomes available.,,2024-08-02,2024-08-02,https://netop.com/,,,,Windows,,C:\Program Files\Danware Data\NetOp Packn Deploy\* | *\Danware Data\NetOp Packn Deploy\* | *\Netop Remote Control\*,,,,,netop.yaml
netop_remote_control_(aka_impero_connect),Netop Remote Control (aka Impero Connect),RMM,Netop Remote Control (aka Impero Connect) is a remote monitoring and management (RMM) tool. More information will be added as it becomes available.,,2024-08-02,2024-08-02,https://netop.com/,,,,,,nhostsvc.exe | nhstw32.exe | nldrw32.exe | rmserverconsolemediator.exe,,,,,netop_remote_control_(aka_impero_connect).yaml
netop_remote_control_(impero_connect),Netop Remote Control (Impero Connect),RMM,Netop Remote Control (Impero Connect) is a remote monitoring and management (RMM) tool. More information will be added as it becomes available.,,2024-08-02,2024-08-02,https://netop.com/,,,,,,nhostsvc.exe | nhstw32.exe | ngstw32.exe | Netop Ondemand.exe | nldrw32.exe | rmserverconsolemediator.exe | ImperoInit.exe | Connect.Backdrop.cloud*.exe | ImperoClientSVC.exe,,,,https://kb.netop.com/article/firewall-and-proxy-server-considerations-when-using-netop-portal-communication-373.html,netop_remote_control_(impero_connect).yaml
netreo,Netreo,RMM,Netreo is a remote monitoring and management (RMM) tool. More information will be added as it becomes available.,,2024-08-02,2024-08-02,https://docs.netreo.com/,,,,,,,,,,https://solutions.netreo.com/docs/firewall-requirements,netreo.yaml
netsupport_manager,NetSupport Manager,RMM,NetSupport Manager is a remote monitoring and management (RMM) tool. More information will be added as it becomes available.,,2024-08-02,2024-08-02,https://www.netsupportmanager.com/,,,,,,pcictlui.exe | pcicfgui.exe | client32.exe,,,,https://www.netsupportmanager.com/resources/,netsupport_manager.yaml
netsupportmanager,NetSupport Manager,RMM,NetSupport Manager is a remote monitoring and management (RMM) tool. More information will be added as it becomes available.,,2024-08-02,2024-08-02,https://www.netsupportmanager.com/,,,,,,pcictlui.exe | client32.exe | pcicfgui.exe,,,,https://www.netsupportmanager.com/resources/,netsupportmanager.yaml
